{
    "spec_version": "0.1.0",
    "analysis_id": "test-step5-mgm",
    "created_at": "2026-01-09T00:00:00Z",
    "input": {
        "schema_ref": "schema.json"
    },
    "engine": {
        "name": "R.mgm",
        "mode": "subprocess_rscript"
    },
    "random_seed": 42,
    "mgm": {
        "k": 2,
        "regularization": {
            "lambda_selection": "EBIC",
            "ebic_gamma": 0.5,
            "alpha": 0.5
        },
        "rule_reg": "AND",
        "overparameterize": true,
        "scale_gaussian": true,
        "sign_info": true
    },
    "edge_mapping": {
        "aggregator": "max_abs",
        "sign_strategy": "dominant",
        "zero_tolerance": 1e-12
    },
    "visualization": {
        "edge_threshold": 0.0,
        "layout": "force"
    },
    "centrality": {
        "compute": true,
        "weighted": true,
        "use_absolute_weights": true
    },
    "missing_policy": {
        "action": "warn_and_abort"
    }
}