{
    "spec_version": "0.1.0",
    "analysis_id": "00000000-0000-0000-0000-000000000001",
    "created_at": "2026-01-09T00:00:00Z",
    "input": {
        "schema_ref": "schema.json"
    },
    "engine": {
        "name": "R.mgm",
        "mode": "subprocess_rscript"
    },
    "mgm": {
        "k": 2,
        "regularization": {
            "lambda_selection": "EBIC",
            "ebic_gamma": 0.5,
            "alpha": 0.5
        },
        "rule_reg": "AND",
        "overparameterize": true
    },
    "edge_mapping": {
        "aggregator": "max_abs",
        "sign_strategy": "dominant",
        "zero_tolerance": 1e-12
    },
    "missing_policy": {
        "action": "warn_and_abort"
    }
}