{
    "spec_version": "0.1.0",
    "analysis_id": "a1b2c3d4-e5f6-7890-abcd-ef1234567890",
    "created_at": "2026-01-09T10:00:00Z",
    "input": {
        "schema_ref": "assets/example_schema.json"
    },
    "engine": {
        "name": "R.mgm",
        "mode": "subprocess_rscript"
    },
    "mgm": {
        "k": 2,
        "regularization": {
            "lambda_selection": "EBIC",
            "ebic_gamma": 0.5,
            "alpha": 0.5
        },
        "rule_reg": "AND",
        "overparameterize": true,
        "scale_gaussian": true,
        "sign_info": true
    },
    "missing_policy": {
        "action": "warn_and_abort"
    },
    "edge_mapping": {
        "aggregator": "max_abs",
        "sign_strategy": "dominant",
        "zero_tolerance": 1e-12
    }
}